question,answer,difficulty,topic
How to interpret the AU ROC score?,"AUC score is the value of *Area Under the ROC Curve*. 

If we assume ROC curve consists of dots, <img src=""https://render.githubusercontent.com/render/math?math=(x_1, y_1), (x_2, y_2), \cdots, (x_m,y_m)"">, then

<img src=""https://render.githubusercontent.com/render/math?math=AUC = rac{1}{2} \sum_{i=1}^{m-1}(x_{i%2B1}-x_i)\cdot (y_i%2By_{i%2B1})"">

An excellent model has AUC near to the 1 which means it has good measure of separability. A poor model has AUC near to the 0 which means it has worst measure of separability. When AUC score is 0.5, it means model has no class separation capacity whatsoever.",intermediate,classification
How can we use CNNs for text classification tasks?,Answer here,advanced,text classification
What is the K-fold Cross Validation?,Answer here,beginner,supervised learning
How do we choose the regularization parameter for linear models?,Answer here,intermediate,regularization
What is the difference between Logistic Regression and Linear Regression?,Answer here,beginner,classification
What are the benefits of using recommender systems?,Answer here,beginner,recommender systems
You have a series with only one variable “y” measured at time t. How do predict “y” at time t+1? Which approaches would you use?,We want to look at the correlation between different observations of y. This measure of correlation is called autocorrelation. Autoregressive models are multiple regression models where the time-lag series of the original time series are treated like multiple independent variables.,intermediate,time series
What is the goal of machine learning?,Answer here,beginner,unsupervised learning
What are the other clustering algorithms do you know?,"* k-medoids: Takes the most central point instead of the mean value as the center of the cluster. This makes it more robust to noise.
* Agglomerative Hierarchical Clustering (AHC): hierarchical clusters combining the nearest clusters starting with each point as its own cluster.
* DIvisive ANAlysis Clustering (DIANA): hierarchical clustering starting with one cluster containing all points and splitting the clusters until each point describes its own cluster.
* Density-Based Spatial Clustering of Applications with Noise (DBSCAN): Cluster defined as maximum set of density-connected points.",intermediate,unsupervised learning
What is the difference between k-fold cross-validation and Leave One Out (LOO) cross-validation?,Answer here,beginner,supervised learning
How would you evaluate your ranking algorithms? Which offline metrics would you use?,Answer here,intermediate,unsupervised learning
What is precision-recall trade-off (PR curve)?,Answer here,intermediate,classification
"What is a recommender system, and how does it work?",Answer here,beginner,recommender systems
How do you use trees for solving time series problems?,Answer here,intermediate,time series
Can you tell me about your work on the topic of domain adaptation for text classification?,Answer here,advanced,text classification
Can you use CNN for text classification?,Answer here,advanced,text classification
How to evaluate performance of classification models?,Answer here,beginner,classification
What are the key components of a data science pipeline?,Answer here,intermediate,supervised learning
What are the types of neural nets?,Answer here,intermediate,neural networks
How can we evaluate the performance of recommender systems?,Answer here,beginner,recommender systems
What is dropout? Why is it useful? How does it work?,"Dropout is a technique that at each training step turns off each neuron with a certain probability of *p*. This way at each iteration we train only *1-p* of neurons, which forces the network not to rely only on the subset of neurons for feature representation. This leads to regularizing effects that are controlled by the hyperparameter *p*.",intermediate,neural networks
Can you explain the use of word embeddings for text classification?,Answer here,advanced,text classification
What are the benefits of machine learning and how can it be applied to your organization?,Answer here,beginner,unsupervised learning
How do you approach the cold start problem?,Answer here,intermediate,recommender systems
What is recommender system?,Answer here,beginner,recommender systems
What is classification and how it differs from regression?,Answer here,beginner,classification
How to select the number of trees in gradient boosting trees model?,Answer here,intermediate,feature selection
What is time series and what are the types of time series?,Answer here,beginner,time series
What is gradient descent?,Answer here,intermediate,supervised learning
What is object segmentation? Do you know any architectures for that?,"Object Segmentation is predicting masks. It does not differentiate objects. 
Architectures :
Mask RCNN, UNet",advanced,neural networks
How do you use XGBoost or LightGBM for text classification?,Answer here,advanced,text classification
Why do we need convolutional layers?,Answer here,intermediate,neural networks
How do you handle missing data in machine learning?,Answer here,beginner,supervised learning
What is the confusion table? What are the cells in this table?,"Confusion table (or confusion matrix) shows how many True positives (TP), True Negative (TN), False Positive (FP) and False Negative (FN) model has made.

||                |     Actual   |        Actual |
|:---:|   :---:        |     :---:    |:---:          |
||                | Positive (1) | Negative (0)  |
|Predicted|   Positive (1) | TP           | FP            |
|Predicted|   Negative (0) | FN           | TN            |

* True Positives (TP): When the actual class of the observation is 1 (True) and the prediction is 1 (True)
* True Negative (TN): When the actual class of the observation is 0 (False) and the prediction is 0 (False)
* False Positive (FP): When the actual class of the observation is 0 (False) and the prediction is 1 (True)
* False Negative (FN): When the actual class of the observation is 1 (True) and the prediction is 0 (False)

Most of the performance metrics for classification models are based on the values of the confusion matrix.",beginner,classification
What is the importance of machine learning algorithms in big data analytics?,Answer here,intermediate,unsupervised learning
Can you explain the concept of recommender systems?,Answer here,beginner,recommender systems
How do we compute the mean squared error in linear models?,Answer here,intermediate,unsupervised learning
How can you use machine learning for text classification with N-grams?,Answer here,intermediate,text classification
What are the applications of machine learning?,Answer here,beginner,unsupervised learning
What is convolutional layer?,Answer here,intermediate,neural networks
How would you use machine learning for text classification with word embeddings?,Answer here,intermediate,text classification
What are the problems with the L2 regularization term?,Answer here,intermediate,regularization
What are the different ways to evaluate model performance?,Answer here,beginner,classification
How can we use CNN model for text classification?,Answer here,advanced,text classification
What is the linear regression model?,Answer here,beginner,supervised learning
Can you tell me about the time series?,Answer here,beginner,time series
What is the importance of Data Science?,Answer here,intermediate,supervised learning
How do we interpret L1 regularization coefficients?,Answer here,intermediate,regularization
What is precision-recall trade-off?,Answer here,intermediate,classification
Which metrics for evaluating regression models do you know?,"1. Mean Squared Error(MSE)
2. Root Mean Squared Error(RMSE)
3. Mean Absolute Error(MAE)
4. R² or Coefficient of Determination
5. Adjusted R²",beginner,supervised learning
What are the advantages of time series analysis?,Answer here,beginner,time series
How do you validate your clustering?,Answer here,beginner,unsupervised learning
How do you know if a regression model is linear?,Answer here,beginner,supervised learning
What are different ways to solve the cold start problem in recommender systems?,Answer here,beginner,recommender systems
What is the concept of feature selection?,Answer here,beginner,feature selection
What regularization techniques do you know?,Answer here,intermediate,regularization
How to train a neural network?,Answer here,beginner,neural networks
What is the difference between statistical and machine learning?,Answer here,intermediate,supervised learning
What is the role of machine learning in recommender systems?,Answer here,beginner,recommender systems
Do you know any dimensionality reduction techniques?,"* Singular Value Decomposition (SVD)
* Principal Component Analysis (PCA)
* Linear Discriminant Analysis (LDA)
* T-distributed Stochastic Neighbor Embedding (t-SNE)
* Autoencoders
* Fourier and Wavelet Transforms",intermediate,unsupervised learning
What is backpropagation? How does it work? Why do we need it?,"The Backpropagation algorithm looks for the minimum value of the error function in weight space using a technique called the delta rule or gradient descent. 
The weights that minimize the error function is then considered to be a solution to the learning problem. 

We need backpropogation because,
* Calculate the error – How far is your model output from the actual output.
* Minimum Error – Check whether the error is minimized or not.
* Update the parameters – If the error is huge then, update the parameters (weights and biases). After that again check the error.  
Repeat the process until the error becomes minimum.
* Model is ready to make a prediction – Once the error becomes minimum, you can feed some inputs to your model and it will produce the output.",intermediate,neural networks
How would you use bag of words?,Answer here,intermediate,text classification
What’s the learning rate?,"The learning rate is an important hyperparameter that controls how quickly the model is adapted to the problem during the training. It can be seen as the ""step width"" during the parameter updates, i.e. how far the weights are moved into the direction of the minimum of our optimization problem.",beginner,neural networks
What are the main components of gradient boosting trees?,Answer here,intermediate,feature selection
You have a series with a “y” variable and a set of features. How do you predict “y” at t+1?,Answer here,intermediate,time series
What is the difference between text classification and text categorization?,Answer here,advanced,text classification
How do you validate regression models?,Answer here,beginner,supervised learning
"1,000,000 random numbers between -1 and 1 with mean 0. What is the standard deviation?",Answer here,intermediate,unsupervised learning
Do you know any other ways to use gradient boosting trees for ranking?,Answer here,advanced,unsupervised learning
What is the difference between gradient boosting model and random forest model?,Answer here,advanced,feature selection
What are some of the most common types of machine learning algorithms used in industry today?,Answer here,intermediate,unsupervised learning
What is the difference between a linear regression model and a multiple regression model?,Answer here,beginner,supervised learning
How to create a text classification model?,Answer here,advanced,text classification
What is gradient boosting trees?,"Gradient boosting is a machine learning technique for regression and classification problems, which produces a prediction model in the form of an ensemble of weak prediction models, typically decision trees.",intermediate,feature selection
How do you evaluate the accuracy of your models?,Answer here,beginner,classification
How do we choose the number of trees in random forest models?,Answer here,intermediate,feature selection
What are the types of machine learning?,Answer here,beginner,unsupervised learning
What do you mean by transfer learning?,Answer here,intermediate,unsupervised learning
What is cold start?,Answer here,intermediate,recommender systems
How do you evaluate the clustering?,Answer here,beginner,unsupervised learning
What is the difference between bagging and random forest model in gradient boosting trees?,Answer here,intermediate,feature selection
What is regularization in linear models?,Answer here,intermediate,regularization
Can you please tell me how do you use CNNs for text classification?,Answer here,advanced,text classification
How can you use text classification with N-grams?,Answer here,advanced,text classification
What do we mean by machine learning?,Answer here,beginner,unsupervised learning
What is Supervised Learning?,Answer here,beginner,supervised learning
What regularization parameters do we have to tune?,Answer here,beginner,regularization
What is TF-IDF? How is it useful for text classification?,"Term Frequency (TF) is a scoring of the frequency of the word in the current document. Inverse Document Frequency(IDF) is a scoring of how rare the word is across documents. It is used in scenario where highly recurring words may not contain as much informational content as the domain specific words. For example, words like “the” that are frequent across all documents therefore need to be less weighted. The TF-IDF score highlights words that are distinct (contain useful information) in a given document.",intermediate,text classification
What’s the interpretation of the bias term in linear models?,"Bias is simply, a difference between predicted value and actual/true value. It can be interpreted as the distance from the average prediction and true value i.e. true value minus mean(predictions). But dont get confused between accuracy and bias.",intermediate,regularization
What is the difference between linear models and generalized linear models?,Answer here,intermediate,regularization
What is the difference between linear models and non-linear models in machine learning?,Answer here,intermediate,supervised learning
What is the importance of using unsupervised learning algorithms for recommendation systems?,Answer here,intermediate,unsupervised learning
What is the K-fold cross-validation?,Answer here,beginner,supervised learning
What is the use of CNN in image classification?,Answer here,advanced,classification
What’s the interpretation of regularization parameters in linear models?,Answer here,intermediate,regularization
How can you use deep learning models for image classification?,Answer here,intermediate,classification
What is the difference between recommender systems and collaborative filtering?,Answer here,intermediate,recommender systems
"What is the difference between machine learning, deep learning, and natural language processing?",Answer here,intermediate,supervised learning
What is sigmoid? What does it do?,"A sigmoid function is a type of activation function, and more specifically defined as a squashing function. Squashing functions limit the output to a range between 0 and 1, making these functions useful in the prediction of probabilities.

Sigmod(x) = 1/(1+e^{-x})",beginner,classification
"If you are an analyst, what is the difference between linear regression and logistic regression?",Answer here,beginner,classification
Can we have both L1 and L2 regularization components in a linear model?,"Yes, elastic net regularization combines L1 and L2 regularization.",intermediate,regularization
What is Time series?,Answer here,beginner,time series
What is the K-fold Cross-validation?,Answer here,beginner,supervised learning
What is the learning rate?,Answer here,beginner,neural networks
Can you please tell me how to use word embeddings for text classification?,Answer here,advanced,text classification
What is ReLU? How is it better than sigmoid or tanh?,"ReLU is an abbreviation for Rectified Linear Unit. It is an activation function which has the value 0 for all negative values and the value f(x) = x for all positive values. The ReLU has a simple activation function which makes it fast to compute and while the sigmoid and tanh activation functions saturate at higher values, the ReLU has a potentially infinite activation, which addresses the problem of vanishing gradients.",intermediate,neural networks
What do you mean by overfitting?,Answer here,beginner,unsupervised learning
What do you know about the use of neural nets for text classification?,Answer here,advanced,text classification
How do we interpret linear models?,Answer here,intermediate,classification
Is there a way to evaluate how well our models perform on unseen data?,Answer here,beginner,regularization
What are the types of machine learning algorithms?,Answer here,intermediate,unsupervised learning
What regularization techniques do we know?,Answer here,intermediate,regularization
What are the types of classification models?,Answer here,beginner,classification
What do we do with AU PR?,Answer here,intermediate,classification
Precision-recall trade-off,"Tradeoff means increasing one parameter would lead to decreasing of other. Precision-recall tradeoff occur due to increasing one of the parameter(precision or recall) while keeping the model same. 

In an ideal scenario where there is a perfectly separable data, both precision and recall can get maximum value of 1.0. But in most of the practical situations, there is noise in the dataset and the dataset is not perfectly separable. There might be some points of positive class closer to the negative class and vice versa. In such cases, shifting the decision boundary can either increase the precision or recall but not both. Increasing one parameter leads to decreasing of the other.",intermediate,classification
How do you solve time series problems?,Answer here,beginner,time series
What do we mean by classification and what are the different types of classification?,Answer here,intermediate,unsupervised learning
What is the difference between a linear regression model and a multivariate linear regression model?,Answer here,intermediate,supervised learning
What is the difference between random forest and gradient boosting tree model?,Answer here,intermediate,feature selection
What is the difference between Linear models and non-linear models?,Answer here,intermediate,regularization
How can we know which features are more important for the decision tree model?,"Often, we want to find a split such that it minimizes the sum of the node impurities. The impurity criterion is a parameter of decision trees. Popular methods to measure the impurity are the Gini impurity and the entropy describing the information gain.",intermediate,feature selection
How do we handle the overfitting problem in neural nets?,Answer here,beginner,neural networks
How do we use the L2 regularization term in linear models?,Answer here,intermediate,regularization
What is the purpose of regularization in linear models?,Answer here,intermediate,regularization
How is time series different from the usual regression problem?,"The principle behind causal forecasting is that the value that has to be predicted is dependant on the input features (causal factors). In time series forecasting, the to be predicted value is expected to follow a certain pattern over time.",beginner,time series
What do we mean by “Deep Learning”?,Answer here,intermediate,unsupervised learning
What is the ROC curve? When to use it?,ROC stands for *Receiver Operating Characteristics*. The diagrammatic representation that shows the contrast between true positive rate vs false positive rate. It is used when we need to predict the probability of the binary outcome.,intermediate,classification
How would you use bag of words for text classification with bag of n-grams?,Answer here,advanced,text classification
How do we know when to use convolutional layers and when to use fully connected layers?,Answer here,intermediate,neural networks
Can you explain what is the difference between linear regression and logistic regression?,Answer here,beginner,classification
"How can we use pre-trained language models like BERT, RoBERTa, and GPT-3 to improve the performance of XGBoost?",Answer here,advanced,feature selection
"If there’s a trend in our series, how we can remove it? And why would we want to do it?","We can explicitly model the trend (and/or seasonality) with approaches such as Holt's Method or Holt-Winter's Method. We want to explicitly model the trend to reach the stationarity property for the data. Many time series approaches require stationarity. Without stationarity,the interpretation of the results of these analyses is problematic [Manuca, Radu & Savit, Robert. (1996). Stationarity and nonstationarity in time series analysis. Physica D: Nonlinear Phenomena. 99. 134-161. 10.1016/S0167-2789(96)00139-X. ].",intermediate,time series
What is the difference between classification and regression?,Answer here,beginner,classification
What are recommender systems? When do we need them?,Answer here,beginner,recommender systems
What’s the regularization parameters for linear models?,Answer here,intermediate,regularization
How do you use the gradient boosting trees for text classification?,Answer here,advanced,text classification
How do we check if a variable follows the normal distribution?,"1. Plot a histogram out of the sampled data. If you can fit the bell-shaped ""normal"" curve to the histogram, then the hypothesis that the underlying random variable follows the normal distribution can not be rejected.
2. Check Skewness and Kurtosis of the sampled data. Skewness = 0 and kurtosis = 3 are typical for a normal distribution, so the farther away they are from these values, the more non-normal the distribution.
3. Use Kolmogorov-Smirnov or/and Shapiro-Wilk tests for normality. They take into account both Skewness and Kurtosis simultaneously.
4. Check for Quantile-Quantile plot. It is a scatterplot created by plotting two sets of quantiles against one another. Normal Q-Q plot place the data points in a roughly straight line.",intermediate,supervised learning
What are the different time series techniques used in time series?,Answer here,intermediate,time series
Do you know any ways to use CNN for ranking?,Answer here,advanced,unsupervised learning
How do you decide which clustering algorithm to use?,Answer here,intermediate,unsupervised learning
How to choose the best regularization parameter?,Answer here,beginner,regularization
How do we select the optimal regularization parameters in linear models?,Answer here,intermediate,regularization
What do we mean by bias-variance trade-off?,Answer here,beginner,unsupervised learning
How can we use machine learning to solve real-world problems?,Answer here,beginner,unsupervised learning
Why do we need to choose random forest model?,Answer here,beginner,feature selection
What is the difference between linear and logistic regression?,Answer here,beginner,classification
What are the different types of algorithms that are used for building recommender systems?,Answer here,advanced,recommender systems
What are the main challenges faced by data scientists today?,Answer here,intermediate,supervised learning
When do we need to use text embeddings?,Answer here,advanced,text classification
What are the different types of recommender systems and how do they differ from each other?,Answer here,beginner,recommender systems
What is time series and how is it different from the usual regression problem?,Answer here,beginner,time series
What is the most common type of error that you see in machine learning models?,Answer here,beginner,supervised learning
What is the difference between linear models and non-linear models?,Answer here,intermediate,regularization
How do we deal with over-fitting in linear models?,Answer here,intermediate,regularization
What’s the PR (precision-recall) curve?,Answer here,intermediate,classification
What is the difference between statistical learning and machine learning?,Answer here,intermediate,supervised learning
What is the difference between cross validation and leave one out?,Answer here,beginner,supervised learning
How can we use clicks data as the training data for ranking algorithms?,Answer here,advanced,unsupervised learning
"What are the main differences between CNN, RNN and LSTMs for text classification?",Answer here,advanced,text classification
What is the cold start problem?,"Collaborative filterung incorporates crowd knowledge to give recommendations for certain items. Say we want to recommend how much a user will like an item, we then will calculate the score using the recommendations of other users for this certain item. We can distinguish between two different ways of a cold start problem now. First, if there is a new item that has not been rated yet, we cannot give any recommendation. Also, when there is a new user, we cannot calculate a similarity to any other user.",intermediate,recommender systems
What are word embeddings? Why are they useful? Do you know Word2Vec?,"Word Embeddings are vector representations for words. Each word is mapped to one vector, this vector tries to capture some characteristics of the word, allowing similar words to have similar vector representations.  
Word Embeddings helps in capturing the inter-word semantics and represents it in real-valued vectors.",intermediate,text classification
What is the effect of regularization in linear models?,Answer here,intermediate,regularization
