question,answer,difficulty,topic
What is time series and how it is different from the standard regression model?,Answer here,beginner,time series
What is the principle of linear regression?,Answer here,beginner,supervised learning
How do we know how many trees we need in random forest?,"The number of trees in random forest is worked by n_estimators, and a random forest reduces overfitting by increasing the number of trees. There is no fixed thumb rule to decide the number of trees in a random forest, it is rather fine tuned with the data, typically starting off by taking the square of the number of features (n) present in the data followed by tuning until we get the optimal results.",intermediate,feature selection
What are the differences between linear models and generalized linear models?,Answer here,intermediate,regularization
How can you deal with the cold start problem in recommender systems?,Answer here,intermediate,recommender systems
What is bag of words?,Answer here,intermediate,text classification
What do we need to know about bias-variance trade-off?,Answer here,beginner,supervised learning
How can we use XGBoost for ranking?,Answer here,advanced,unsupervised learning
What are the main assumptions of linear regression?,"There are several assumptions of linear regression. If any of them is violated, model predictions and interpretation may be worthless or misleading.

1. **Linear relationship** between features and target variable.
2. **Additivity** means that the effect of changes in one of the features on the target variable does not depend on values of other features. For example, a model for predicting revenue of a company have of two features - the number of items _a_ sold and the number of items _b_ sold. When company sells more items _a_ the revenue increases and this is independent of the number of items _b_ sold. But, if customers who buy _a_ stop buying _b_, the additivity assumption is violated.
3. Features are not correlated (no **collinearity**) since it can be difficult to separate out the individual effects of collinear features on the target variable.
4. Errors are independently and identically normally distributed (y<sub>i</sub> = B0 + B1*x1<sub>i</sub> + ... + error<sub>i</sub>):
   1. No correlation between errors (consecutive errors in the case of time series data).
   2. Constant variance of errors - **homoscedasticity**. For example, in case of time series, seasonal patterns can increase errors in seasons with higher activity.
   3. Errors are normally distributed, otherwise some features will have more influence on the target variable than to others. If the error distribution is significantly non-normal, confidence intervals may be too wide or too narrow.",intermediate,supervised learning
What do we mean by cross-validation?,Answer here,beginner,unsupervised learning
What is the difference between Random Forests and Gradient Boosting Trees?,Answer here,intermediate,feature selection
How can you use bag of words for text classification?,Answer here,intermediate,text classification
What is ROC (AU PR)?,Answer here,intermediate,classification
What is the difference between gradient boosting trees and random forests?,Answer here,intermediate,feature selection
How do we choose the regularization parameter in linear models?,Answer here,intermediate,regularization
How can we use word embeddings for sentiment analysis?,Answer here,advanced,text classification
What regularization techniques are applicable to linear models?,Answer here,intermediate,regularization
How would you approach the following problem?,Answer here,intermediate,unsupervised learning
How can we perform feature scaling in linear models?,Answer here,intermediate,regularization
How can you use Keras to train neural networks for text classification?,Answer here,beginner,text classification
What is gradient descent? How does it work?,"Gradient descent is an algorithm that uses calculus concept of gradient to try and reach local or global minima. It works by taking the negative of the gradient in a point of a given function, and updating that point repeatedly using the calculated negative gradient, until the algorithm reaches a local or global minimum, which will cause future iterations of the algorithm to return values that are equal or too close to the current point. It is widely used in machine learning applications.",intermediate,supervised learning
What is linear regression? When do we use it?,"Linear regression is a model that assumes a linear relationship between the input variables (X) and the single output variable (y).

With a simple equation:

```
y = B0 + B1*x1 + ... + Bn * xN
```

B is regression coefficients, x values are the independent (explanatory) variables  and y is dependent variable.

The case of one explanatory variable is called simple linear regression. For more than one explanatory variable, the process is called multiple linear regression.

Simple linear regression:

```
y = B0 + B1*x1
```

Multiple linear regression:

```
y = B0 + B1*x1 + ... + Bn * xN
```",beginner,supervised learning
Is it possible to parallelize training of a gradient boosting model? How to do it?,"Yes, different frameworks provide different options to make training faster, using GPUs to speed up the process by making it highly parallelizable.For example, for XGBoost <i>tree_method = 'gpu_hist'</i> option makes training faster by use of GPUs.",intermediate,feature selection
What is AUC (AU ROC)?,Answer here,intermediate,classification
How can we use Convolutional Neural Networks (CNNs) for image classification?,Answer here,intermediate,neural networks
What is time series? What are the types of time series?,Answer here,beginner,time series
How can we use bag of words for text classification with bag of words?,Answer here,advanced,text classification
What is the k-fold cross-validation?,Answer here,beginner,supervised learning
What do you mean by Big Data?,Answer here,intermediate,unsupervised learning
Which is the most popular machine learning algorithm?,Answer here,intermediate,unsupervised learning
Do you have any idea how to use CNN for text classification?,Answer here,advanced,text classification
What is K-fold cross-validation?,"K fold cross validation is a method of cross validation where we select a hyperparameter k. The dataset is now divided into k parts. Now, we take the 1st part as validation set and remaining k-1 as training set. Then we take the 2nd part as validation set and remaining k-1 parts as training set. Like this, each part is used as validation set once and the remaining k-1 parts are taken together and used as training set.
It should not be used in a time series data.",beginner,supervised learning
How do we train the neural nets?,Answer here,beginner,neural networks
When would you use Adam and when SGD?,"Adam tends to converge faster, while SGD often converges to more optimal solutions.",intermediate,neural networks
What is neural net?,Answer here,intermediate,neural networks
What is the difference between gradient boosting trees (GBT) and XGBoost?,Answer here,advanced,feature selection
Can we use machine learning for text classification with bag of words features?,Answer here,intermediate,text classification
What if we want to build a model for predicting prices? Are prices distributed normally? Do we need to do any pre-processing for prices?,"Data is not normal. Specially, real-world datasets or uncleaned datasets always have certain skewness. Same goes for the price prediction. Price of houses or any other thing under consideration depends on a number of factors. So, there's a great chance of presence of some skewed values i.e outliers if we talk in data science terms. 

Yes, you may need to do pre-processing. Most probably, you will need to remove the outliers to make your distribution near-to-normal.",intermediate,supervised learning
How do we train a neural net?,Answer here,beginner,neural networks
What do you know about machine learning?,Answer here,beginner,unsupervised learning
Do you know how DBScan works?,"* Two input parameters epsilon (neighborhood radius) and minPts (minimum number of points in an epsilon-neighborhood)
* Cluster defined as maximum set of density-connected points.
* Points p_j and p_i are density-connected w.r.t. epsilon and minPts if there is a point o such that both, i and j are density-reachable from o w.r.t. epsilon and minPts.
* p_j is density-reachable from p_i w.r.t. epsilon, minPts if there is a chain of points p_i -> p_i+1 -> p_i+x = p_j such that p_i+x is directly density-reachable from p_i+x-1.
* p_j is a directly density-reachable point of the neighborhood of p_i if dist(p_i,p_j) <= epsilon.",intermediate,unsupervised learning
The interviewer wants you to write a program that takes in a 2D array and returns the sum of its elements. How do you solve this problem?,Answer here,intermediate,classification
What is the curse of dimensionality? Why do we care about it?,"Data in only one dimension is relatively tightly packed. Adding a dimension stretches the points across that dimension, pushing them further apart. Additional dimensions spread the data even further making high dimensional data extremely sparse. We care about it, because it is difficult to use machine learning in sparse spaces.",intermediate,unsupervised learning
Why do we need activation functions?,"The main idea of using neural networks is to learn complex nonlinear functions. If we are not using an activation function in between different layers of a neural network, we are just stacking up multiple linear layers one on top of another and this leads to learning a linear function. The Nonlinearity comes only with the activation function, this is the reason we need activation functions.",beginner,neural networks
How do I find the minimum and maximum values of a column in Python?,Answer here,intermediate,classification
How would you design a machine learning model that predicts the probability of a customer defaulting on their loan?,Answer here,beginner,supervised learning
What is the difference between classification and regression models?,Answer here,beginner,classification
What are the current trends in Machine Learning?,Answer here,beginner,unsupervised learning
How to choose the regularization parameter in linear models?,Answer here,intermediate,regularization
How to choose which augmentations to use?,"Augmentations really depend on the type of output classes and the features you want your model to learn. For eg. if you have mostly properly illuminated images in your dataset and want your model to predict poorly illuminated images too, you can apply channel shifting on your data and include the resultant images in your dataset for better results.",intermediate,neural networks
What are recommender systems?,Answer here,beginner,recommender systems
Which feature selection techniques do you know?,"Here are some of the feature selections:
- Principal Component Analysis
- Neighborhood Component Analysis
- ReliefF Algorithm",intermediate,feature selection
What is K-fold cross validation?,Answer here,beginner,supervised learning
What is the difference between linear regression and ordinary least squares regression?,Answer here,beginner,supervised learning
What is random forest?,"Random Forest is a machine learning method for regression and classification which is composed of many decision trees. Random Forest belongs to a larger class of ML algorithms called ensemble methods (in other words, it involves the combination of several models to solve a single prediction problem).",beginner,feature selection
How do we select the number of trees in random forest models?,Answer here,intermediate,feature selection
What are the advantages and disadvantages of linear models compared to non-linear models?,Answer here,intermediate,regularization
How do you decide which clustering algorithms to use?,Answer here,intermediate,unsupervised learning
What is the difference between XGBoost and LightGBM models?,Answer here,advanced,feature selection
What is SGD — stochastic gradient descent? What’s the difference with the usual gradient descent?,"In both gradient descent (GD) and stochastic gradient descent (SGD), you update a set of parameters in an iterative manner to minimize an error function.

The difference lies in how the gradient of the loss function is estimated. In the usual GD, you have to run through ALL the samples in your training set in order to estimate the gradient and do a single update for a parameter in a particular iteration. In SGD, on the other hand, you use ONLY ONE or SUBSET of training sample from your training set to estimate the gradient and do the update for a parameter in a particular iteration. If you use SUBSET, it is called Minibatch Stochastic gradient Descent.",intermediate,supervised learning
Is it possible to create a machine learning model that has no bias?,Answer here,beginner,supervised learning
What are the common approaches to building an effective recommender system?,Answer here,intermediate,recommender systems
What is the difference between gradient boosting trees and random forest models?,Answer here,advanced,feature selection
What’s K-fold cross-validation?,Answer here,beginner,supervised learning
How can we use machine learning for search?,Answer here,intermediate,unsupervised learning
How do we evaluate the performance of a model?,Answer here,beginner,classification
What is the best way to use word embeddings?,Answer here,advanced,text classification
What is Linear Regression?,Answer here,beginner,supervised learning
Is there any difference between linear regression and logistic regression?,Answer here,beginner,classification
What are the most important steps in supervised machine learning?,Answer here,beginner,supervised learning
What is an activation function?,Answer here,beginner,neural networks
Do you know any other ways to use CNNs for ranking?,Answer here,advanced,unsupervised learning
What are the problems with sigmoid as an activation function?,The derivative of the sigmoid function for large positive or negative numbers is almost zero. From this comes the problem of vanishing gradient — during the backpropagation our net will not learn (or will learn drastically slow). One possible way to solve this problem is to use ReLU activation function.,intermediate,neural networks
What is logistic regression?,Answer here,beginner,classification
What is time series and what are the different types?,Answer here,beginner,time series
What are the different types of artificial networks to be used in recommender systems?,Answer here,beginner,recommender systems
"How do we split the dataset into train, validation and test sets?",Answer here,beginner,supervised learning
How can we use word embeddings to improve sentiment classification?,Answer here,advanced,text classification
Why do we need learning rates?,Answer here,beginner,neural networks
What is the difference between bag of words and word embedding?,Answer here,intermediate,text classification
Are CNNs resistant to rotations? What happens to the predictions of a CNN if an image is rotated?,"CNNs are not resistant to rotation by design. However, we can make our models resistant by augmenting our datasets with different rotations of the raw data. The predictions of a CNN will change if an image is rotated and we did not augment our dataset accordingly. A demonstration of this occurence can be seen in [this video](https://www.youtube.com/watch?v=VO1bQo4PXV4), where a CNN changes its predicted class between a duck and a rabbit based on the rotation of the image.",advanced,neural networks
How do we know which feature importance measure to use?,Answer here,intermediate,feature selection
How would you use N-grams for text classification with bag of words?,Answer here,advanced,text classification
How to set the learning rate?,There is no straightforward way of finding an optimum learning rate for a model. It involves a lot of hit and trial. Usually starting with a small values such as 0.01 is a good starting point for setting a learning rate and further tweaking it so that it doesn't overshoot or converge too slowly.,intermediate,neural networks
What are the main components of gradient boosting trees models?,Answer here,intermediate,feature selection
What are time series and how do they differ from the traditional regression models?,Answer here,beginner,time series
What is the difference between Linear Regression and Ridge Regression?,Answer here,beginner,supervised learning
What are the different ways to use gradient boosting trees for text classification?,Answer here,advanced,text classification
Can you tell us how you approach the model training process?,Answer here,intermediate,neural networks
What is the difference between convolutional layers and fully-connected layers?,Answer here,advanced,neural networks
How do I go about building a recommender system?,Answer here,intermediate,recommender systems
What is CNN (Convolutional Neural Network) and how does it work?,Answer here,advanced,neural networks
What is the difference between Random Forest and Gradient Boosting Tree?,Answer here,intermediate,feature selection
What is transfer learning?,Answer here,intermediate,neural networks
How do we interpret the weights in linear models?,Answer here,intermediate,regularization
What are the problems with the gradient descent algorithm?,Answer here,intermediate,unsupervised learning
What is time series?,Answer here,beginner,time series
How would you approach the cold start problem?,Answer here,intermediate,recommender systems
How would you use text classification with bag of words?,Answer here,advanced,text classification
What is the difference between Random Forest model and Gradient Boosting Model?,Answer here,intermediate,feature selection
What is collaborative filtering?,"* Collaborative filtering is the most prominent approach to generate recommendations.
* It uses the wisdom of the crowd, i.e. it gives recommendations based on the experience of others.
* A recommendation is calculated as the average of other experiences.
* Say we want to give a score that indicates how much user u will like an item i. Then we can calculate it with the experience of N other users U as r_ui = 1/N * sum(v in U) r_vi.
* In order to rate similar experiences with a higher weight, we can introduce a similarity between users that we use as a multiplier for each rating.
* Also, as users have an individual profile, one user may have an average rating much larger than another user, so we use normalization techniques (e.g. centering or Z-score normalization) to remove the users' biases.
* Collaborative filtering does only need a rating matrix as input and improves over time. However, it does not work well on sparse data, does not work for cold starts (see below) and usually tends to overfit.",intermediate,recommender systems
Why do we need to use neural nets for deep learning?,Answer here,intermediate,neural networks
How can we use the CNN architecture for text classification?,Answer here,advanced,text classification
What is the gradient descent algorithm?,Answer here,intermediate,unsupervised learning
"Given a matrix, find the sum of all its elements. How would you solve this problem?",Answer here,intermediate,classification
Do we need regularization in linear models?,Answer here,intermediate,regularization
How do we train the model?,Answer here,beginner,supervised learning
What is object detection? Do you know any architectures for that?,"Object detection is finding Bounding Boxes around objects in an image. 
Architectures :
YOLO, Faster RCNN, Center Net",advanced,neural networks
What’s your favorite K-fold cross-validation?,Answer here,beginner,supervised learning
What's the difference between k-means clustering and k-medoids clustering?,Answer here,intermediate,unsupervised learning
What is AU PR?,Answer here,intermediate,classification
What is machine learning and how does it differ from traditional AI?,Answer here,beginner,unsupervised learning
How do we select the optimal regularization parameters for linear models?,Answer here,intermediate,regularization
What is the concept of supervised learning?,Answer here,beginner,supervised learning
What are the different kinds of machine learning models?,Answer here,beginner,supervised learning
What is the use of time series?,Answer here,beginner,time series
What is the best way to represent a continuous numerical variable in a dataset?,Answer here,advanced,supervised learning
How can we use deep learning for recommender systems?,Answer here,intermediate,recommender systems
What is the difference between machine learning and artificial intelligence?,Answer here,intermediate,supervised learning
What is the difference between k-means clustering and hierarchical clustering?,Answer here,intermediate,unsupervised learning
What is the main difference between Random Forest and Gradient Boosting Model?,Answer here,intermediate,feature selection
What is data science and what are the key skills required to become a data scientist?,Answer here,intermediate,supervised learning
Can you tell me something about time series?,Answer here,beginner,time series
What’s the difference between random forest and gradient boosting?,"1. Random Forests builds each tree independently while Gradient Boosting builds one tree at a time.
   2. Random Forests combine results at the end of the process (by averaging or ""majority rules"") while Gradient Boosting combines     results along the way.",intermediate,feature selection
Can you tell me something about your experience in using transformers and how they can be used for text classification?,Answer here,advanced,text classification
What are different ways to solve the cold start problem?,Answer here,beginner,recommender systems
Which optimization techniques for training neural nets do you know?,"* Gradient Descent
* Stochastic Gradient Descent
* Mini-Batch Gradient Descent(best among gradient descents)
* Nesterov Accelerated Gradient
* Momentum
* Adagrad 
* AdaDelta
* Adam(best one. less time, more efficient)",intermediate,neural networks
What is the main difference between random forest model and gradient boosting model in terms of performance?,Answer here,intermediate,feature selection
What are recommender systems? What do they do?,Answer here,beginner,recommender systems
In which cases AU PR is better than AU ROC?,"What is different however is that AU ROC looks at a true positive rate TPR and false positive rate FPR while AU PR looks at positive predictive value PPV and true positive rate TPR.

Typically, if true negatives are not meaningful to the problem or you care more about the positive class, AU PR is typically going to be more useful; otherwise, If you care equally about the positive and negative class or your dataset is quite balanced, then going with AU ROC is a good idea.",intermediate,classification
How do you validate your models?,Answer here,beginner,supervised learning
What is time series and how does it differ from the usual regression model?,Answer here,beginner,time series
What are the problems that machine learning algorithms face when applied to real-world data?,Answer here,intermediate,unsupervised learning
When do we need to use random forests?,Answer here,beginner,feature selection
How do you evaluate the performance of your machine learning models?,Answer here,beginner,supervised learning
What is the difference between CNN and RNN?,Answer here,advanced,neural networks
Explain the difference between linear regression and logistic regression. 2. How can we use logistic regression to predict whether a customer will purchase a product?,Answer here,beginner,classification
How can we use CNNs for text classification?,Answer here,advanced,text classification
When do we need the regression model?,Answer here,beginner,supervised learning
What is regularization? Why do we need it?,Regularization is used to reduce overfitting in machine learning models. It helps the models to generalize well and make them robust to outliers and noise in the data.,beginner,regularization
How do we deal with time series problems?,Answer here,beginner,time series
What is the difference between linear models and nonlinear models?,Answer here,intermediate,regularization
What’s the regularization parameter for linear models?,Answer here,intermediate,regularization
What are the problems in time series?,Answer here,beginner,time series
What is the difference between Linear Models and Linear Models?,Answer here,intermediate,regularization
How do we know when to stop training?,Answer here,beginner,neural networks
What are good unsupervised baselines for text information retrieval?,Answer here,intermediate,unsupervised learning
What is text classification?,Answer here,advanced,text classification
What is the bias-variance trade-off?,"**Bias** is the error introduced by approximating the true underlying function, which can be quite complex, by a simpler model. **Variance** is a model sensitivity to changes in the training dataset.

**Bias-variance trade-off** is a relationship between the expected test error and the variance and the bias - both contribute to the level of the test error and ideally should be as small as possible:

```
ExpectedTestError = Variance + Bias² + IrreducibleError
```

But as a model complexity increases, the bias decreases and the variance increases which leads to *overfitting*. And vice versa, model simplification helps to decrease the variance but it increases the bias which leads to *underfitting*.",beginner,supervised learning
Is it possible to use random forest model in the case of imbalanced dataset?,Answer here,intermediate,feature selection
