question,difficulty
You have a series with only one variable “y” measured at time t. How do predict “y” at time t+1? Which approaches would you use?,intermediate
How do you evaluate regression models?,beginner
What are the different types of machine learning models?,beginner
Is accuracy always a good metric?,beginner
"If you have a sentence with multiple words, you may need to combine multiple word embeddings into one. How would you do it?",intermediate
Can you tell us more about how you would use XGBoost or LightGBM to solve the recommendation system problem?,advanced
What is linear regression? When do we use it?,beginner